{
  "campaign": {
    "title": "Ford Manufacturer Campaign — Phase 2A Identity Resolution",
    "phase": "2A",
    "scope": "identityResolutionOnly",
    "baseCommit": "b45d2b2626e8b9a09eed1c8a9f0ebc4f639a82ec",
    "phase1PartialCandidates": 80,
    "processedCandidates": 80,
    "statusCounts": {
      "identityResolved": 0,
      "identityBridgeReady": 0,
      "publicDesignationOnly": 26,
      "sharedIdentityResolved": 2,
      "unresolved": 52,
      "notProductionEligible": 0
    },
    "identifierFindings": {
      "manufacturerCodes": 0,
      "engineeringCodes": 0,
      "partnerCodes": 0,
      "publicDesignationsOnly": 26,
      "officialPartnerDesignations": 2
    },
    "readyForPhase2B": 0,
    "checkpoints": [
      {
        "processed": 20,
        "status": "complete"
      },
      {
        "processed": 40,
        "status": "complete"
      },
      {
        "processed": 60,
        "status": "complete"
      },
      {
        "processed": 80,
        "status": "complete"
      }
    ],
    "coverage": {
      "families": {
        "ford-family-335": 1,
        "ford-family-385-lima-big-block": 1,
        "ford-family-australian-boss": 1,
        "ford-family-barra": 4,
        "ford-family-cht": 1,
        "ford-family-cleveland": 1,
        "ford-family-cologne-v6": 2,
        "ford-family-coyote-derivative": 2,
        "ford-family-cvh": 2,
        "ford-family-cyclone": 1,
        "ford-family-dld": 3,
        "ford-family-dragon": 1,
        "ford-family-dragon-ecoboost": 1,
        "ford-family-duratec-direct-flex": 1,
        "ford-family-duratec-he-mazda-l": 1,
        "ford-family-duratorq-puma": 2,
        "ford-family-ecoblue": 1,
        "ford-family-ecoblue-panther": 1,
        "ford-family-ecoboost": 3,
        "ford-family-ecoboost-v6": 1,
        "ford-family-ecotorq": 2,
        "ford-family-endura-e": 1,
        "ford-family-essex-v4": 1,
        "ford-family-essex-v6": 1,
        "ford-family-falcon-six": 2,
        "ford-family-fe": 2,
        "ford-family-flathead-v8": 2,
        "ford-family-ford-big-six": 1,
        "ford-family-ford-cosworth-bda": 1,
        "ford-family-ford-cosworth-yb": 1,
        "ford-family-godzilla": 1,
        "ford-family-hcs": 1,
        "ford-family-kent": 1,
        "ford-family-kent-crossflow": 2,
        "ford-family-lima-ohc": 1,
        "ford-family-modular": 3,
        "ford-family-nano-ecoboost-v6": 2,
        "ford-family-navistar-t444e-power-stroke": 1,
        "ford-family-navistar-vt365-power-stroke": 1,
        "ford-family-pinto-ohc": 2,
        "ford-family-power-stroke": 1,
        "ford-family-power-stroke-lion": 1,
        "ford-family-psa-dw12-ford-duratorq": 1,
        "ford-family-sho-v6": 1,
        "ford-family-sigma": 2,
        "ford-family-sigma-ti-vct": 1,
        "ford-family-valencia": 1,
        "ford-family-vulcan": 1,
        "ford-family-windsor-small-block": 3,
        "ford-family-y-block": 2,
        "ford-family-zetec-e": 3,
        "ford-family-zetec-rocam": 1,
        "ford-family-zetec-se-sigma": 2
      },
      "markets": {
        "Africa": 6,
        "Asia": 6,
        "Australia/New Zealand": 10,
        "China": 3,
        "Europe": 36,
        "India": 4,
        "Mexico": 2,
        "Middle East": 5,
        "North America": 40,
        "South America": 10,
        "Turkey": 2
      },
      "categories": {
        "heavyCommercial": 2,
        "lightCommercial": 4,
        "passengerVehicle": 58,
        "racing": 2,
        "suvPickup": 14
      }
    },
    "publicIdentityQualityCounts": {
      "stableOfficialDesignation": 15,
      "descriptiveLabelOnly": 4,
      "ambiguousAcrossVariants": 7
    },
    "unresolvedBlockerCounts": {
      "MISSING_STABLE_IDENTIFIER": 5,
      "DESCRIPTIVE_DESIGNATION_ONLY": 2,
      "AMBIGUOUS_DESIGNATION_ACROSS_VARIANTS": 3,
      "MISSING_CODE_APPLICATION_BINDING": 2,
      "SHARED_RELATIONSHIP_UNRESOLVED": 7,
      "INSUFFICIENT_SOURCE_IDENTITY_EVIDENCE": 33
    },
    "partNumberReconciliation": {
      "phase1Total": 20,
      "alreadyRepresented": 20,
      "phase2aCandidates": 0,
      "categoryCounts": {
        "crateEngine": 20,
        "racing": 0,
        "industrial": 0,
        "marine": 0
      },
      "candidateIds": [
        "ford-performance-m-6007-23tb",
        "ford-performance-m-6007-33v6na",
        "ford-performance-m-6007-35ta",
        "ford-performance-m-6007-572df",
        "ford-performance-m-6007-572dr",
        "ford-performance-m-6007-73b",
        "ford-performance-m-6007-a52xs",
        "ford-performance-m-6007-d347sr",
        "ford-performance-m-6007-d347sr7",
        "ford-performance-m-6007-m50d",
        "ford-performance-m-6007-m50dauto",
        "ford-performance-m-6007-mz73",
        "ford-performance-m-6007-s347jr2",
        "ford-performance-m-6007-x2302e",
        "ford-performance-m-6007-z2363ft",
        "ford-performance-m-6007-z2363rt",
        "ford-performance-m-6007-z2427fft",
        "ford-performance-m-6007-z2427frt",
        "ford-performance-m-6007-z460fft",
        "ford-performance-m-6007-z460frt"
      ],
      "conclusion": "All Phase 1 part-number identities are existing Ford Performance crate-engine product records in the 30 alreadyRepresented set; none belongs to the 80 Phase 2A candidates."
    },
    "officialPublicDesignationFeasibility": {
      "currentPublicDesignationOnlyPotential": 15,
      "unresolvedPotentialAfterEnrichment": 37,
      "unresolvedStillRequiringExactCodeOrRelationshipEvidence": 15,
      "recommendation": "implementWithStrictSeparateIdentityType"
    }
  },
  "resolutions": [
    {
      "candidateId": "ford-335-400",
      "familyId": "ford-family-335",
      "phase1Designation": "400",
      "previousIdentifierType": "familyDesignation",
      "resolvedCode": null,
      "resolvedIdentifierType": "none",
      "manufacturerOwner": "Ford Motor Company",
      "fordRelationship": "fordDesigned",
      "partner": null,
      "fordDesignation": "400",
      "partnerCode": null,
      "applications": [
        "Ford passenger cars",
        "Ford F-Series"
      ],
      "markets": [
        "North America"
      ],
      "documentedPeriod": {
        "start": null,
        "end": null,
        "approximate": true
      },
      "category": "suvPickup",
      "phase2aStatus": "unresolved",
      "resolutionReason": "MISSING_STABLE_IDENTIFIER",
      "sourceRefs": [
        "ford-heritage-vault"
      ],
      "exactEvidenceLocation": "Phase 1 points only to the Ford Heritage Vault landing archive; no candidate-specific page or section binds an exact code/application.",
      "identityLimitation": "The registered evidence does not establish a stable official identifier beyond a displacement label or an unconfirmed nickname.",
      "productionEligibility": "blockedPendingIdentityEvidence",
      "readyForPhase2B": false,
      "nextRequiredFields": [
        "exactCode",
        "codeApplicationBinding",
        "documentedYears"
      ],
      "recommendedPhase2BAction": "Locate an official parts, service, homologation, or application document that literally binds the exact code to the candidate application and period.",
      "checkpoint": 20,
      "publicIdentityQuality": null,
      "futureIdentityPathAssessment": "exactCodeOrRelationshipRequired"
    },
    {
      "candidateId": "ford-385-460",
      "familyId": "ford-family-385-lima-big-block",
      "phase1Designation": "460",
      "previousIdentifierType": "familyDesignation",
      "resolvedCode": null,
      "resolvedIdentifierType": "none",
      "manufacturerOwner": "Ford Motor Company",
      "fordRelationship": "fordDesigned",
      "partner": null,
      "fordDesignation": "460",
      "partnerCode": null,
      "applications": [
        "Ford F-Series",
        "Lincoln passenger cars"
      ],
      "markets": [
        "North America"
      ],
      "documentedPeriod": {
        "start": null,
        "end": null,
        "approximate": true
      },
      "category": "suvPickup",
      "phase2aStatus": "unresolved",
      "resolutionReason": "MISSING_STABLE_IDENTIFIER",
      "sourceRefs": [
        "ford-heritage-vault"
      ],
      "exactEvidenceLocation": "Phase 1 points only to the Ford Heritage Vault landing archive; no candidate-specific page or section binds an exact code/application.",
      "identityLimitation": "The registered evidence does not establish a stable official identifier beyond a displacement label or an unconfirmed nickname.",
      "productionEligibility": "blockedPendingIdentityEvidence",
      "readyForPhase2B": false,
      "nextRequiredFields": [
        "exactCode",
        "codeApplicationBinding",
        "documentedYears"
      ],
      "recommendedPhase2BAction": "Locate an official parts, service, homologation, or application document that literally binds the exact code to the candidate application and period.",
      "checkpoint": 20,
      "publicIdentityQuality": null,
      "futureIdentityPathAssessment": "exactCodeOrRelationshipRequired"
    },
    {
      "candidateId": "ford-australia-boss-335",
      "familyId": "ford-family-australian-boss",
      "phase1Designation": "Boss 335",
      "previousIdentifierType": "familyDesignation",
      "resolvedCode": null,
      "resolvedIdentifierType": "none",
      "manufacturerOwner": "Ford Motor Company",
      "fordRelationship": "fordDesigned",
      "partner": null,
      "fordDesignation": "Boss 335",
      "partnerCode": null,
      "applications": [
        "FPV GT"
      ],
      "markets": [
        "Australia/New Zealand"
      ],
      "documentedPeriod": {
        "start": null,
        "end": null,
        "approximate": true
      },
      "category": "passengerVehicle",
      "phase2aStatus": "unresolved",
      "resolutionReason": "INSUFFICIENT_SOURCE_IDENTITY_EVIDENCE",
      "sourceRefs": [
        "ford-heritage-vault"
      ],